[
  {
    "jobTitle": "Full Stack Engineer",
    "jobOrg": "TempStars",
    "jobLocation": "Toronto, ON",
    "applicationLink": "https://www.linkedin.com/jobs/view/3876408207/",
    "jobDescription": "Who We Are\n\n\n\nTempStars is the leading dental temping and hiring technology-powered marketplace in North America, connecting over 10,000 dental offices with more than 21,000 dental professionals.\n\n\nOur platform provides a streamlined and efficient way for dental offices to post temping shifts and permanent job positions, with customizable hourly rates and role requirements.\n\n\nDental professionals can easily search and offer their services at their preferred rates. With a user-centric approach and a robust review and performance management system, TempStars has achieved over 97% satisfaction among dental offices.\n\n\nTempStars is the leader and innovator in the dental temping and hiring space, with an adventurous and early-adopter spirit and risk tolerance to push the envelope of technology.\n\n\nRole Description\n\n\n\nThis is a full-time hybrid role for an expert Full Stack Engineer located in Toronto, ON. The role includes both office and remote work. As a Full Stack Engineer, you will be responsible for back-end and front-end web and mobile development to build and iterate on our successful and growing platform.\n\n\nWho You Are\n\n\n\nYou are located in Ontario with the ability to meet regularly in the GTA, for in-person collaboration, as a hybrid remote and in-person (2 days per week) position.\n\n\nYou are seasoned and experienced in React, Cordova, Framework 7, Vue.js, Node.js, and SQL with a portfolio to match. Experience is mid-level DevOps for AWS infrastructure is a plus.\n\n\nAn enthusiastic and early adopter of A.I. tools and capabilities - both from an internal productivity standpoint, and for implementing A.I. to provide delightful user value in UI/UX.\n\n\nMotivated by TempStars' mission to improve the work lives of dental professionals and driven by the core values of trustworthiness, data-informed decisions, and growth learning & adaptation.\n\n\nQualifications\n\nStrong skills in Back-End Web Development, Front-End Development, and Full-Stack Development\nHTML, JavaScript, CSS, React\nNode.js, React, Apache Cordova, SQL\nAWS (EC2, RDS, S3)\nExperience in web and mobile application development (iOS & Android)\nKnowledge of programming languages such as JavaScript, HTML, and CSS\nExperience with A.I. api calls and coding assistants is a bonus\nExcellent problem-solving and debugging skills\nAbility to work collaboratively in a team environment\nStrong communication and documentation skills\nBachelor's degree in Computer Science, Software Engineering, or related field\n\n\nWhy TempStars?\n\n\n\nBecome part of a team led by a practicing dentist and thought leader in the dental industry, and contribute to a product that boasts over 500,000 hours of shifts filled and improves the dental work experience across North America, making a positive impact on the work lives of dental professionals.\n\n\nTake advantage of the opportunity to work with a company on the leading edge of innovations that values direct connections, transparency, and community, in a rewarding environment where innovation is encouraged, and your work directly impacts the lives of thousands.\n\n\nHow to Apply\n\n\n\nWe'd ask that interested candidates apply only if you live in the Greater Toronto Area and are able to meet regularly in person for collaborative work. \n\n\n\nPlease submit your resume, a brief cover letter explaining your interest and how you align with TempStars' mission and values, and any relevant portfolio items or GitHub links.\n\n\nWe're looking forward to meeting a developer who's not just looking for a job, but a meaningful career on the innovative edge for web and mobile technology, improving the lives of those in the dental profession.",
    "deadline": "Full Stack Engineer",
    "experienceRequired": "NA",
    "techSkillsArr": [
      "Back-End Web Development",
      " Front-End Development",
      " Full-Stack Development",
      " HTML",
      " JavaScript",
      " CSS",
      " React",
      " Node.js",
      " Apache Cordova",
      " SQL",
      " AWS (EC2",
      " RDS",
      " S3)",
      " web and mobile application development (iOS & Android)",
      " programming languages such as JavaScript",
      " HTML",
      " and CSS",
      " A.I. api calls and coding assistants is a bonus",
      " problem-solving and debugging skills",
      " work collaboratively in a team environment",
      " communication and documentation skills",
      " Bachelor's degree in Computer Science",
      " Software Engineering",
      " or related field"
    ],
    "jobId": "d5def4ef-c365-42d0-b2d4-10d63c0029e8"
  },
  {
    "jobTitle": "Software Developer Co-Op (Capture)",
    "jobOrg": "Copperleaf ",
    "jobLocation": "Vancouver, BC ",
    "applicationLink": "https://boards.greenhouse.io/copperleaf/jobs/7430791002?gh_src=b26b45782us&source=LinkedIn",
    "jobDescription": "Software Developer Co-Op (Capture)\n\nLocation: Vancouver, BC \n\nExpected Start Date: Sept 2024\n\nLength: 8 - month Co-Op term \n\nAs one of BC’s Top Employers (2023), Canada’s Top Growing Companies (2023), and Canada’s Most Admired Corporate Cultures (2023), Copperleaf is a dynamic and disruptive high-tech organization offering exciting opportunities for growth and innovation.\n\nHeadquartered in Vancouver, Canada, Copperleaf is building a better world, one decision at a time. The Copperleaf Decision Analytics Solution helps some of the world’s largest firms make better strategic decisions through data analytics and optimization. We have a track record of delivering award-winning, industry-changing solutions. Join our team as we continue to enable our clients to build more resilient and sustainable infrastructure.\n\nThe Opportunity:\n\nWe are looking for a talented Software Developer Co-op to join our Capture Team; a cross-functional team of collaborative, enthusiastic, and supportive individuals dedicated to delivering exceptional value to our clients. Currently, the team is focused on spearheading an exciting new initiative to complement Copperleaf's current offerings.\n\nYou’ll be responsible for:\n\nCollaborating with team members on planning, design, development, code reviews, and testing.\nContributing to the development of new features, shared components, and maintenance of existing features.\nWorking on a variety of tasks to help the team meet delivery goals.\nWorking with team members to discover ways to continually improve, from our products to our team processes.\nWhat experience will you gain?\n\nThis position provides an excellent opportunity to gain exposure to the following:\n\nDeveloping sophisticated, web-based applications with a C# and Oracle relational database.\nDesign, implementation, review, and testing of software components.\nDevelopment of both server-side and web UI components.\nFront-end development technologies (HTML5, Angular, CSS3, TypeScript, and RESTful APIs).\nUsing AI tools to support your programming and overall work experience.\nUnit, Integration, and End-to-end Automated Testing, as well as manual quality assurance.\nCoding best practices.\nWorking in a cross-functional team.\nAgile Methodologies (Scrum)\nAbout You:\n\nYou have the following background, but we also recognize that talent comes in many forms:\n\nYou are a 3rd or 4th year computing science or engineering student with previous software development experience.\nYou have experience with object-oriented languages, relational databases, web technologies and front-end components.\nYou have experience with source control (Git) and programming languages such as TypeScript, C#, HTML, CSS.\nYou are self-motivated, flexible, pragmatic, proactive, and able to handle a variety of tasks.\nYou are a great team member and have interpersonal skills including teamwork, respect, courtesy, and discretion.\nYou are curious to learn and open to sharing your ideas.\nYou have strong written and verbal communication skills with experience working in a team environment.\nWe're not hung up on how much experience you may have with a specific programming language or technology. However, we like to see skill, passion and creativity in the work and projects you've completed.\n\nWhat are we looking for?\n\nHere are some tips about what our hiring managers look for during Co-Op recruitment. \n\nA well-written cover letter (recommended) - We use cover letters to learn more about you and how your skills, knowledge, and experience make you a good candidate for our role and our company. This is your chance to stand out and help us see who you are beyond what you can list on a resume. \nExtracurricular activities (optional) - If you are involved in extra-curricular activities, please share them in your resume and cover letter. Hearing about these allows us to understand more about who you are. \nTranscripts (optional) - Just like extracurricular activities, if you have one feel free to upload yours. Non-official transcripts are perfect. We know there's more to like than grades, but they're part of the picture. \nA bespoke application (required) - At Copperleaf, we love artificial intelligence. In fact, we have our own in-house AI tools and strongly encourage our teams to utilize them! However, we're not looking for AI-generated cover letters and resumes. We want to see your writing style and learn more about you. Note, we don't use AI for reviewing resumes and applications. \nWhat Our Co-ops Are Saying\n\n\"Copperleaf provided me with an excellent overall co-op experience. The job involved a wide variety of interesting challenges as well as great people to work with and learn from. I would highly recommend considering Copperleaf for a rewarding and memorable work term.\"\n\n-Jeff, previous Software Developer Co-op\n\n\"As a software developer co-op student with Copperleaf, I was able to rapidly learn and hone a variety of skills. My co-workers provided an enriching working and learning environment, and I was also given a great amount of independence on the projects I completed.\"\n\n-Yuqing, previous Software Developer Co-op\n\n\"I enjoyed my co-op work term here a lot. I had the opportunity to work on a complete feature from server-side functionality to front-end functionality. When I first started at Copperleaf, I was eased into the role with relevant tasks and training that allowed me to build my knowledge on the application before diving into more complicated problems and tasks. I was also able to work with a great team of people. Everyone is very friendly and eager to help or provide suggestions to improve the application from both a development and user perspective. We also knew how to have fun with foosball tournaments and pizza parties. I am thankful I had the opportunity to work in such an amazing environment!\"",
    "deadline": "NA",
    "experienceRequired": "NA",
    "techSkillsArr": [
      "C#",
      " Oracle",
      " HTML5",
      " Angular",
      " CSS3",
      " TypeScript",
      " RESTful APIs",
      " Git"
    ],
    "jobId": "8547a2f6-352d-4539-a0ba-14aff0d13c10"
  }
]